<?xml version="1.0" encoding="UTF-8"?>
<Waardelijst schemaversie="1.3.2"
   xmlns="https://standaarden.overheid.nl/stop/imop/resources/"
   xmlns:rsc="https://standaarden.overheid.nl/stop/imop/resources/"
   xmlns:xsi="http://www.w3.org/2001/XMLSchema-instance"
   xsi:schemaLocation="https://standaarden.overheid.nl/stop/imop/resources/
   https://standaarden.overheid.nl/stop/1.3.2/imop-resources.xsd">
   <WaardelijstInfo>
      <id>/tooi/def/class/Provincie</id>
      <label>Provincies</label>
      <beschrijving>Alle provincies uit GRS </beschrijving>
      <vindplaatsen>
         <heeftVindplaats>
            <Vindplaats>
               <url>https://identifier.overheid.nl/tooi/set/rwc_provincies_compleet</url>
            </Vindplaats>
         </heeftVindplaats>
      </vindplaatsen>
      <uitbreidbaar>0</uitbreidbaar>
      <versie>1.3.2</versie>
   </WaardelijstInfo>
   <Waarde>
      <id>/tooi/id/provincie/pv22</id>
      <label>provincie Drenthe</label>
      <vindplaatsen>
         <heeftVindplaats>
            <Vindplaats>
               <url>https://identifier.overheid.nl/tooi/id/provincie/pv22</url>
            </Vindplaats>
         </heeftVindplaats>
      </vindplaatsen>
   </Waarde>
   <Waarde>
      <id>/tooi/id/provincie/pv24</id>
      <label>provincie Flevoland</label>
      <vindplaatsen>
         <heeftVindplaats>
            <Vindplaats>
               <url>https://identifier.overheid.nl/tooi/id/provincie/pv24</url>
            </Vindplaats>
         </heeftVindplaats>
      </vindplaatsen>
   </Waarde>
   <Waarde>
      <id>/tooi/id/provincie/pv21</id>
      <label>provincie Frysl√¢n</label>
      <vindplaatsen>
         <heeftVindplaats>
            <Vindplaats>
               <url>https://identifier.overheid.nl/tooi/id/provincie/pv21</url>
            </Vindplaats>
         </heeftVindplaats>
      </vindplaatsen>
   </Waarde>
   <Waarde>
      <id>/tooi/id/provincie/pv25</id>
      <label>provincie Gelderland</label>
      <vindplaatsen>
         <heeftVindplaats>
            <Vindplaats>
               <url>https://identifier.overheid.nl/tooi/id/provincie/pv25</url>
            </Vindplaats>
         </heeftVindplaats>
      </vindplaatsen>
   </Waarde>
   <Waarde>
      <id>/tooi/id/provincie/pv20</id>
      <label>provincie Groningen</label>
      <vindplaatsen>
         <heeftVindplaats>
            <Vindplaats>
               <url>https://identifier.overheid.nl/tooi/id/provincie/pv20</url>
            </Vindplaats>
         </heeftVindplaats>
      </vindplaatsen>
   </Waarde>
   <Waarde>
      <id>/tooi/id/provincie/pv31</id>
      <label>provincie Limburg</label>
      <vindplaatsen>
         <heeftVindplaats>
            <Vindplaats>
               <url>https://identifier.overheid.nl/tooi/id/provincie/pv31</url>
            </Vindplaats>
         </heeftVindplaats>
      </vindplaatsen>
   </Waarde>
   <Waarde>
      <id>/tooi/id/provincie/pv30</id>
      <label>provincie Noord-Brabant</label>
      <vindplaatsen>
         <heeftVindplaats>
            <Vindplaats>
               <url>https://identifier.overheid.nl/tooi/id/provincie/pv30</url>
            </Vindplaats>
         </heeftVindplaats>
      </vindplaatsen>
   </Waarde>
   <Waarde>
      <id>/tooi/id/provincie/pv27</id>
      <label>provincie Noord-Holland</label>
      <vindplaatsen>
         <heeftVindplaats>
            <Vindplaats>
               <url>https://identifier.overheid.nl/tooi/id/provincie/pv27</url>
            </Vindplaats>
         </heeftVindplaats>
      </vindplaatsen>
   </Waarde>
   <Waarde>
      <id>/tooi/id/provincie/pv23</id>
      <label>provincie Overijssel</label>
      <vindplaatsen>
         <heeftVindplaats>
            <Vindplaats>
               <url>https://identifier.overheid.nl/tooi/id/provincie/pv23</url>
            </Vindplaats>
         </heeftVindplaats>
      </vindplaatsen>
   </Waarde>
   <Waarde>
      <id>/tooi/id/provincie/pv26</id>
      <label>provincie Utrecht</label>
      <vindplaatsen>
         <heeftVindplaats>
            <Vindplaats>
               <url>https://identifier.overheid.nl/tooi/id/provincie/pv26</url>
            </Vindplaats>
         </heeftVindplaats>
      </vindplaatsen>
   </Waarde>
   <Waarde>
      <id>/tooi/id/provincie/pv29</id>
      <label>provincie Zeeland</label>
      <vindplaatsen>
         <heeftVindplaats>
            <Vindplaats>
               <url>https://identifier.overheid.nl/tooi/id/provincie/pv29</url>
            </Vindplaats>
         </heeftVindplaats>
      </vindplaatsen>
   </Waarde>
   <Waarde>
      <id>/tooi/id/provincie/pv28</id>
      <label>provincie Zuid-Holland</label>
      <vindplaatsen>
         <heeftVindplaats>
            <Vindplaats>
               <url>https://identifier.overheid.nl/tooi/id/provincie/pv28</url>
            </Vindplaats>
         </heeftVindplaats>
      </vindplaatsen>
   </Waarde>
</Waardelijst>
