<?xml version="1.0" encoding="UTF-8"?>
<Waardelijst xmlns="https://standaarden.overheid.nl/stop/imop/resources/"
             xmlns:rsc="https://standaarden.overheid.nl/stop/imop/resources/"
             xmlns:xsi="http://www.w3.org/2001/XMLSchema-instance"
             xsi:schemaLocation="https://standaarden.overheid.nl/stop/imop/resources/       https://standaarden.overheid.nl/stop/2.0.0/imop-resources.xsd"
             schemaversie="2.0.0">
   <WaardelijstInfo>
      <id>/join/id/stop/procedure/ontwerpbesluit</id>
      <label>Stappen uit de besluitvormingsprocedure voor een ontwerpbesluit</label>
      <beschrijving>De waardelijst beschrijft de stappen die gezet kunnen worden als onderdeel van een
      besluitvormingsprocedure voor een ontwerpbesluit. De waardelijst beschrijft alleen de stappen
      vanaf de vaststelling van een besluit. Sommige waarden uit deze lijst komen ook voor in
      /join/id/stop/procedure/definitiefbesluit</beschrijving>
      <vindplaatsen>
         <heeftVindplaats>
            <Vindplaats>
               <url>https://identifier.overheid.nl/tooi/set/ccw_stop_stappen_besluitvorming_ontwerpbesluit</url>
            </Vindplaats>
         </heeftVindplaats>
      </vindplaatsen>
      <uitbreidbaar>0</uitbreidbaar>
      <versie>2.0.0</versie>
   </WaardelijstInfo>
   <Waarde>
      <id>/join/id/stop/procedure/stap_002</id>
      <label>Vaststelling</label>
      <vindplaatsen>
         <heeftVindplaats>
            <Vindplaats>
               <url>https://identifier.overheid.nl/tooi/def/thes/kern/c_641ecd76</url>
            </Vindplaats>
         </heeftVindplaats>
      </vindplaatsen>
   </Waarde>
   <Waarde>
      <id>/join/id/stop/procedure/stap_003</id>
      <label>Ondertekening</label>
      <vindplaatsen>
         <heeftVindplaats>
            <Vindplaats>
               <url>https://identifier.overheid.nl/tooi/def/thes/kern/c_e1ec050e</url>
            </Vindplaats>
         </heeftVindplaats>
      </vindplaatsen>
   </Waarde>
   <Waarde>
      <id>/join/id/stop/procedure/stap_004</id>
      <label>Publicatie</label>
      <vindplaatsen>
         <heeftVindplaats>
            <Vindplaats>
               <url>https://identifier.overheid.nl/tooi/def/thes/kern/c_932b7730</url>
            </Vindplaats>
         </heeftVindplaats>
      </vindplaatsen>
   </Waarde>
   <Waarde>
      <id>/join/id/stop/procedure/stap_005</id>
      <label>Einde inzagetermijn</label>
      <vindplaatsen>
         <heeftVindplaats>
            <Vindplaats>
               <url>https://identifier.overheid.nl/tooi/def/thes/kern/c_1c457490</url>
            </Vindplaats>
         </heeftVindplaats>
      </vindplaatsen>
   </Waarde>
   <Waarde>
      <id>/join/id/stop/procedure/stap_014</id>
      <label>Begin inzagetermijn</label>
      <vindplaatsen>
         <heeftVindplaats>
            <Vindplaats>
               <url>https://identifier.overheid.nl/tooi/def/thes/kern/c_dad20b4a</url>
            </Vindplaats>
         </heeftVindplaats>
      </vindplaatsen>
   </Waarde>
</Waardelijst>
