<?xml version="1.0" encoding="UTF-8"?>
<Waardelijst schemaversie="1.3.0"
   xmlns="https://standaarden.overheid.nl/stop/imop/resources/"
   xmlns:rsc="https://standaarden.overheid.nl/stop/imop/resources/"
   xmlns:xsi="http://www.w3.org/2001/XMLSchema-instance"
   xsi:schemaLocation="https://standaarden.overheid.nl/stop/imop/resources/
   https://standaarden.overheid.nl/stop/1.3.0/imop-resources.xsd">
   <WaardelijstInfo>
      <id>/join/id/stop/soortpublicatie</id>
      <label>Typering van publicaties</label>
      <beschrijving>De waardelijst beschrijft de typering van officiÃ«le publicaties</beschrijving>
      <uitbreidbaar>0</uitbreidbaar>
      <versie>1.3.0</versie>
   </WaardelijstInfo>
   <Waarde>
      <id>/join/id/stop/soortpublicatie_001</id>
      <label>Bekendmaking</label>
   </Waarde>
   <Waarde>
      <id>/join/id/stop/soortpublicatie_002</id>
      <label>Kennisgeving</label>
   </Waarde>
   <Waarde>
      <id>/join/id/stop/soortpublicatie_003</id>
      <label>Rectificatie</label>
   </Waarde>
</Waardelijst>
