<?xml version="1.0" encoding="utf-8"?>
<Waardelijst schemaversie="1.2.0" xmlns="https://standaarden.overheid.nl/stop/imop/resources/" xmlns:rsc="https://standaarden.overheid.nl/stop/imop/resources/" xmlns:xsi="http://www.w3.org/2001/XMLSchema-instance" xsi:schemaLocation="https://standaarden.overheid.nl/stop/imop/resources/
  https://standaarden.overheid.nl/stop/1.2.0/imop-resources.xsd">
  <WaardelijstInfo>
    <id>/join/id/stop/procedure/definitiefbesluit</id>
    <label>Stappen uit de besluitvormingsprocedure voor een definitief besluit</label>
    <beschrijving>De waardelijst beschrijft de stappen die gezet kunnen worden als onderdeel van een
      besluitvormingsprocedure voor een definitief besluit. De waardelijst beschrijft alleen de
      stappen vanaf de vaststelling van een besluit. De waarden komen overeen met
      /join/id/stop/procedure/ontwerpbesluit</beschrijving>
    <uitbreidbaar>false</uitbreidbaar>
    <versie>@@@VERSIES@@@</versie>
  </WaardelijstInfo>
  <Waarde>
    <id>/join/id/stop/procedure/stap_002</id>
    <label>Vaststelling</label>
  </Waarde>
  <Waarde>
    <id>/join/id/stop/procedure/stap_003</id>
    <label>Ondertekening</label>
  </Waarde>
  <Waarde>
    <id>/join/id/stop/procedure/stap_004</id>
    <label>Publicatie</label>
  </Waarde>
  <Waarde>
    <id>/join/id/stop/procedure/stap_015</id>
    <label>Einde bezwaartermijn</label>
  </Waarde>
  <Waarde>
    <id>/join/id/stop/procedure/stap_016</id>
    <label>Einde beroepstermijn</label>
  </Waarde>
  <Waarde>
    <id>/join/id/stop/procedure/stap_018</id>
    <label>Beroep(en) ingesteld</label>
  </Waarde>
  <Waarde>
    <id>/join/id/stop/procedure/stap_019</id>
    <label>Schorsing</label>
  </Waarde>
  <Waarde>
    <id>/join/id/stop/procedure/stap_020</id>
    <label>Schorsing opgeheven</label>
  </Waarde>
  <Waarde>
    <id>/join/id/stop/procedure/stap_021</id>
    <label>Beroep(en) definitief afgedaan</label>
  </Waarde>
</Waardelijst>
