<?xml version="1.0" encoding="UTF-8"?>
<Waardelijst schemaversie="1.3.0"
   xmlns="https://standaarden.overheid.nl/stop/imop/resources/"
   xmlns:rsc="https://standaarden.overheid.nl/stop/imop/resources/"
   xmlns:xsi="http://www.w3.org/2001/XMLSchema-instance"
   xsi:schemaLocation="https://standaarden.overheid.nl/stop/imop/resources/
   https://standaarden.overheid.nl/stop/1.3.0/imop-resources.xsd">
   <WaardelijstInfo>
      <id>/join/id/stop/soortregeling</id>
      <label>Typering van regelingen</label>
      <beschrijving>De waardelijst beschrijft de regelingtypen die door STOP onderkend worden. Dat
         is inclusief domein-specifieke besluiten uit in toepassingsprofielen voor zover het
         onderscheiden daarvan het STOP domein raakt. Dat laatste is bijvoorbeeld het geval als
         bepaalde tijdstempels van rechtswege bepaald worden.</beschrijving>
      <vindplaatsen>
         <heeftVindplaats>
            <Vindplaats>
               <url>https://identifier.overheid.nl/tooi/set/ccw_stop_regelingsoorten_tpod</url>
            </Vindplaats>
         </heeftVindplaats>
      </vindplaatsen>
      <uitbreidbaar>0</uitbreidbaar>
      <versie>1.3.0</versie>
   </WaardelijstInfo>
   <Waarde>
      <id>/join/id/stop/regelingtype_001</id>
      <label>AMvB</label>
      <beschrijving>Algemene Maatregel van Bestuur</beschrijving>
      <vindplaatsen>
         <heeftVindplaats>
            <Vindplaats>
               <url>https://identifier.overheid.nl/tooi/def/thes/kern/c_964af97a</url>
            </Vindplaats>
         </heeftVindplaats>
      </vindplaatsen>
   </Waarde>
   <Waarde>
      <id>/join/id/stop/regelingtype_002</id>
      <label>MinisteriÃ«le Regeling</label>
      <vindplaatsen>
         <heeftVindplaats>
            <Vindplaats>
               <url>https://identifier.overheid.nl/tooi/def/thes/kern/c_d2a6707c</url>
            </Vindplaats>
         </heeftVindplaats>
      </vindplaatsen>
   </Waarde>
   <Waarde>
      <id>/join/id/stop/regelingtype_003</id>
      <label>Omgevingsplan</label>
      <vindplaatsen>
         <heeftVindplaats>
            <Vindplaats>
               <url>https://identifier.overheid.nl/tooi/def/thes/kern/c_0887da8f</url>
            </Vindplaats>
         </heeftVindplaats>
      </vindplaatsen>
   </Waarde>
   <Waarde>
      <id>/join/id/stop/regelingtype_004</id>
      <label>Omgevingsverordening</label>
      <vindplaatsen>
         <heeftVindplaats>
            <Vindplaats>
               <url>https://identifier.overheid.nl/tooi/def/thes/kern/c_c30d04d4</url>
            </Vindplaats>
         </heeftVindplaats>
      </vindplaatsen>
   </Waarde>
   <Waarde>
      <id>/join/id/stop/regelingtype_005</id>
      <label>Waterschapsverordening</label>
      <vindplaatsen>
         <heeftVindplaats>
            <Vindplaats>
               <url>https://identifier.overheid.nl/tooi/def/thes/kern/c_84a23404</url>
            </Vindplaats>
         </heeftVindplaats>
      </vindplaatsen>
   </Waarde>
   <Waarde>
      <id>/join/id/stop/regelingtype_006</id>
      <label>Omgevingsvisie</label>
      <vindplaatsen>
         <heeftVindplaats>
            <Vindplaats>
               <url>https://identifier.overheid.nl/tooi/def/thes/kern/c_0776061d</url>
            </Vindplaats>
         </heeftVindplaats>
      </vindplaatsen>
   </Waarde>
   <Waarde>
      <id>/join/id/stop/regelingtype_007</id>
      <label>Projectbesluit</label>
      <vindplaatsen>
         <heeftVindplaats>
            <Vindplaats>
               <url>https://identifier.overheid.nl/tooi/def/thes/kern/c_c74a0781</url>
            </Vindplaats>
         </heeftVindplaats>
      </vindplaatsen>
   </Waarde>
   <Waarde>
      <id>/join/id/stop/regelingtype_008</id>
      <label>Instructie</label>
      <vindplaatsen>
         <heeftVindplaats>
            <Vindplaats>
               <url>https://identifier.overheid.nl/tooi/def/thes/kern/c_8f68c804</url>
            </Vindplaats>
         </heeftVindplaats>
      </vindplaatsen>
   </Waarde>
   <Waarde>
      <id>/join/id/stop/regelingtype_009</id>
      <label>Voorbeschermingsregels</label>
      <vindplaatsen>
         <heeftVindplaats>
            <Vindplaats>
               <url>https://identifier.overheid.nl/tooi/def/thes/kern/c_5cbd74c8</url>
            </Vindplaats>
         </heeftVindplaats>
      </vindplaatsen>
   </Waarde>
   <Waarde>
      <id>/join/id/stop/regelingtype_010</id>
      <label>Programma</label>
      <vindplaatsen>
         <heeftVindplaats>
            <Vindplaats>
               <url>https://identifier.overheid.nl/tooi/def/thes/kern/c_3f4ec90d</url>
            </Vindplaats>
         </heeftVindplaats>
      </vindplaatsen>
   </Waarde>
   <Waarde>
      <id>/join/id/stop/regelingtype_011</id>
      <label>Reactieve interventie</label>
      <vindplaatsen>
         <heeftVindplaats>
            <Vindplaats>
               <url>https://identifier.overheid.nl/tooi/def/thes/kern/c_9757fbcf</url>
            </Vindplaats>
         </heeftVindplaats>
      </vindplaatsen>
   </Waarde>
   <Waarde>
      <id>/join/id/stop/regelingtype_012</id>
      <label>Aanwijzingsbesluit N2000</label>
      <vindplaatsen>
         <heeftVindplaats>
            <Vindplaats>
               <url>https://identifier.overheid.nl/tooi/def/thes/kern/c_6b572c33</url>
            </Vindplaats>
         </heeftVindplaats>
      </vindplaatsen>
   </Waarde>
   <Waarde>
      <id>/join/id/stop/regelingtype_013</id>
      <label>Toegangsbeperkingsbesluit</label>
      <vindplaatsen>
         <heeftVindplaats>
            <Vindplaats>
               <url>https://identifier.overheid.nl/tooi/def/thes/kern/c_5bea6262</url>
            </Vindplaats>
         </heeftVindplaats>
      </vindplaatsen>
   </Waarde>
   <Waarde>
      <id>/join/id/stop/regelingtype_014</id>
      <label>Omgevingsplanregels Projectbesluit</label>
      <vindplaatsen>
         <heeftVindplaats>
            <Vindplaats>
               <url>https://identifier.overheid.nl/tooi/def/thes/kern/c_cd480cce</url>
            </Vindplaats>
         </heeftVindplaats>
      </vindplaatsen>
   </Waarde>
   <Waarde>
      <id>/join/id/stop/regelingtype_015</id>
      <label>Voorbeschermingsregels Omgevingsplan</label>
      <vindplaatsen>
         <heeftVindplaats>
            <Vindplaats>
               <url>https://identifier.overheid.nl/tooi/def/thes/kern/c_8226285b</url>
            </Vindplaats>
         </heeftVindplaats>
      </vindplaatsen>
   </Waarde>
   <Waarde>
      <id>/join/id/stop/regelingtype_016</id>
      <label>Voorbeschermingsregels Omgevingsverordening</label>
      <vindplaatsen>
         <heeftVindplaats>
            <Vindplaats>
               <url>https://identifier.overheid.nl/tooi/def/thes/kern/c_526e0a9f</url>
            </Vindplaats>
         </heeftVindplaats>
      </vindplaatsen>
   </Waarde>
</Waardelijst>
