<?xml version="1.0" encoding="UTF-8"?>
<Waardelijst schemaversie="1.2.0"
  xmlns="https://standaarden.overheid.nl/stop/imop/resources/"
  xmlns:rsc="https://standaarden.overheid.nl/stop/imop/resources/"
  xmlns:xsi="http://www.w3.org/2001/XMLSchema-instance"
  xsi:schemaLocation="https://standaarden.overheid.nl/stop/imop/resources/
  https://standaarden.overheid.nl/stop/1.2.0/imop-resources.xsd">
  <WaardelijstInfo>
    <id>/join/id/stop/bekendmakingsblad</id>
    <label>bekendmakingsblad</label>
    <beschrijving>officiÃ«le bekendmakingsbladen. Deze sublijst is in TOOI beschikbaar als
      /tooi/def/concept/c_c392702e</beschrijving>
    <uitbreidbaar>false</uitbreidbaar>
    <versie>1.2.0</versie>
  </WaardelijstInfo>
  <Waarde>
    <id>/tooi/def/concept/c_61e3099a</id>
    <label>Staatsblad</label>
    <beschrijving>Stb</beschrijving>
  </Waarde>
  <Waarde>
    <id>/tooi/def/concept/c_0670bae1</id>
    <label>Staatscourant</label>
    <beschrijving>Stcrt</beschrijving>
  </Waarde>
  <Waarde>
    <id>/tooi/def/concept/c_bdc265d5</id>
    <label>Provinciaal blad</label>
    <beschrijving>Prb</beschrijving>
  </Waarde>
  <Waarde>
    <id>/tooi/def/concept/c_b3179555</id>
    <label>Tractatenblad</label>
    <beschrijving>Trb</beschrijving>
  </Waarde>
  <Waarde>
    <id>/tooi/def/concept/c_81cc2eb5</id>
    <label>Gemeenteblad</label>
    <beschrijving>Gmb</beschrijving>
  </Waarde>
  <Waarde>
    <id>/tooi/def/concept/c_c97b118a</id>
    <label>Waterschapsblad</label>
    <beschrijving>Wsb</beschrijving>
  </Waarde>
  <Waarde>
    <id>/tooi/def/concept/c_12cd7b9b</id>
    <label>Blad gemeenschappelijke regeling</label>
    <beschrijving>Bgr</beschrijving>
  </Waarde>
</Waardelijst>
