<?xml version="1.0" encoding="UTF-8"?>
<Waardelijst schemaversie="1.3.2"
   xmlns="https://standaarden.overheid.nl/stop/imop/resources/"
   xmlns:rsc="https://standaarden.overheid.nl/stop/imop/resources/"
   xmlns:xsi="http://www.w3.org/2001/XMLSchema-instance"
   xsi:schemaLocation="https://standaarden.overheid.nl/stop/imop/resources/
   https://standaarden.overheid.nl/stop/1.3.2/imop-resources.xsd">
   <WaardelijstInfo>
      <id>/tooi/def/class/Waterschap</id>
      <label>Waterschappen</label>
      <beschrijving>Alle waterschappen uit GRS </beschrijving>
      <vindplaatsen>
         <heeftVindplaats>
            <Vindplaats>
               <url>https://identifier.overheid.nl/tooi/set/rwc_waterschappen_compleet</url>
            </Vindplaats>
         </heeftVindplaats>
      </vindplaatsen>
      <uitbreidbaar>0</uitbreidbaar>
      <versie>1.3.2</versie>
   </WaardelijstInfo>
   <Waarde>
      <id>/tooi/id/waterschap/ws0654</id>
      <label>waterschap Aa en Maas</label>
      <vindplaatsen>
         <heeftVindplaats>
            <Vindplaats>
               <url>https://identifier.overheid.nl/tooi/id/waterschap/ws0654</url>
            </Vindplaats>
         </heeftVindplaats>
      </vindplaatsen>
   </Waarde>
   <Waarde>
      <id>/tooi/id/waterschap/ws0155</id>
      <label>waterschap Amstel, Gooi en Vecht</label>
      <vindplaatsen>
         <heeftVindplaats>
            <Vindplaats>
               <url>https://identifier.overheid.nl/tooi/id/waterschap/ws0155</url>
            </Vindplaats>
         </heeftVindplaats>
      </vindplaatsen>
   </Waarde>
   <Waarde>
      <id>/tooi/id/waterschap/ws0652</id>
      <label>waterschap Brabantse Delta</label>
      <vindplaatsen>
         <heeftVindplaats>
            <Vindplaats>
               <url>https://identifier.overheid.nl/tooi/id/waterschap/ws0652</url>
            </Vindplaats>
         </heeftVindplaats>
      </vindplaatsen>
   </Waarde>
   <Waarde>
      <id>/tooi/id/waterschap/ws0539</id>
      <label>waterschap De Dommel</label>
      <vindplaatsen>
         <heeftVindplaats>
            <Vindplaats>
               <url>https://identifier.overheid.nl/tooi/id/waterschap/ws0539</url>
            </Vindplaats>
         </heeftVindplaats>
      </vindplaatsen>
   </Waarde>
   <Waarde>
      <id>/tooi/id/waterschap/ws0664</id>
      <label>waterschap Drents Overijsselse Delta</label>
      <vindplaatsen>
         <heeftVindplaats>
            <Vindplaats>
               <url>https://identifier.overheid.nl/tooi/id/waterschap/ws0664</url>
            </Vindplaats>
         </heeftVindplaats>
      </vindplaatsen>
   </Waarde>
   <Waarde>
      <id>/tooi/id/waterschap/ws0655</id>
      <label>waterschap Hollandse Delta</label>
      <vindplaatsen>
         <heeftVindplaats>
            <Vindplaats>
               <url>https://identifier.overheid.nl/tooi/id/waterschap/ws0655</url>
            </Vindplaats>
         </heeftVindplaats>
      </vindplaatsen>
   </Waarde>
   <Waarde>
      <id>/tooi/id/waterschap/ws0636</id>
      <label>Hoogheemraadschap De Stichtse Rijnlanden</label>
      <vindplaatsen>
         <heeftVindplaats>
            <Vindplaats>
               <url>https://identifier.overheid.nl/tooi/id/waterschap/ws0636</url>
            </Vindplaats>
         </heeftVindplaats>
      </vindplaatsen>
   </Waarde>
   <Waarde>
      <id>/tooi/id/waterschap/ws0651</id>
      <label>Hoogheemraadschap Hollands Noorderkwartier</label>
      <vindplaatsen>
         <heeftVindplaats>
            <Vindplaats>
               <url>https://identifier.overheid.nl/tooi/id/waterschap/ws0651</url>
            </Vindplaats>
         </heeftVindplaats>
      </vindplaatsen>
   </Waarde>
   <Waarde>
      <id>/tooi/id/waterschap/ws0372</id>
      <label>Hoogheemraadschap van Delfland</label>
      <vindplaatsen>
         <heeftVindplaats>
            <Vindplaats>
               <url>https://identifier.overheid.nl/tooi/id/waterschap/ws0372</url>
            </Vindplaats>
         </heeftVindplaats>
      </vindplaatsen>
   </Waarde>
   <Waarde>
      <id>/tooi/id/waterschap/ws0616</id>
      <label>Hoogheemraadschap van Rijnland</label>
      <vindplaatsen>
         <heeftVindplaats>
            <Vindplaats>
               <url>https://identifier.overheid.nl/tooi/id/waterschap/ws0616</url>
            </Vindplaats>
         </heeftVindplaats>
      </vindplaatsen>
   </Waarde>
   <Waarde>
      <id>/tooi/id/waterschap/ws0656</id>
      <label>Hoogheemraadschap van Schieland en de Krimpenerwaard</label>
      <vindplaatsen>
         <heeftVindplaats>
            <Vindplaats>
               <url>https://identifier.overheid.nl/tooi/id/waterschap/ws0656</url>
            </Vindplaats>
         </heeftVindplaats>
      </vindplaatsen>
   </Waarde>
   <Waarde>
      <id>/tooi/id/waterschap/ws0646</id>
      <label>waterschap Hunze en Aa's</label>
      <vindplaatsen>
         <heeftVindplaats>
            <Vindplaats>
               <url>https://identifier.overheid.nl/tooi/id/waterschap/ws0646</url>
            </Vindplaats>
         </heeftVindplaats>
      </vindplaatsen>
   </Waarde>
   <Waarde>
      <id>/tooi/id/waterschap/ws0647</id>
      <label>waterschap Noorderzijlvest</label>
      <vindplaatsen>
         <heeftVindplaats>
            <Vindplaats>
               <url>https://identifier.overheid.nl/tooi/id/waterschap/ws0647</url>
            </Vindplaats>
         </heeftVindplaats>
      </vindplaatsen>
   </Waarde>
   <Waarde>
      <id>/tooi/id/waterschap/ws0152</id>
      <label>waterschap Rijn en IJssel</label>
      <vindplaatsen>
         <heeftVindplaats>
            <Vindplaats>
               <url>https://identifier.overheid.nl/tooi/id/waterschap/ws0152</url>
            </Vindplaats>
         </heeftVindplaats>
      </vindplaatsen>
   </Waarde>
   <Waarde>
      <id>/tooi/id/waterschap/ws0621</id>
      <label>waterschap Rivierenland</label>
      <vindplaatsen>
         <heeftVindplaats>
            <Vindplaats>
               <url>https://identifier.overheid.nl/tooi/id/waterschap/ws0621</url>
            </Vindplaats>
         </heeftVindplaats>
      </vindplaatsen>
   </Waarde>
   <Waarde>
      <id>/tooi/id/waterschap/ws0661</id>
      <label>waterschap Scheldestromen</label>
      <vindplaatsen>
         <heeftVindplaats>
            <Vindplaats>
               <url>https://identifier.overheid.nl/tooi/id/waterschap/ws0661</url>
            </Vindplaats>
         </heeftVindplaats>
      </vindplaatsen>
   </Waarde>
   <Waarde>
      <id>/tooi/id/waterschap/ws0662</id>
      <label>waterschap Vallei en Veluwe</label>
      <vindplaatsen>
         <heeftVindplaats>
            <Vindplaats>
               <url>https://identifier.overheid.nl/tooi/id/waterschap/ws0662</url>
            </Vindplaats>
         </heeftVindplaats>
      </vindplaatsen>
   </Waarde>
   <Waarde>
      <id>/tooi/id/waterschap/ws0663</id>
      <label>waterschap Vechtstromen</label>
      <vindplaatsen>
         <heeftVindplaats>
            <Vindplaats>
               <url>https://identifier.overheid.nl/tooi/id/waterschap/ws0663</url>
            </Vindplaats>
         </heeftVindplaats>
      </vindplaatsen>
   </Waarde>
   <Waarde>
      <id>/tooi/id/waterschap/ws0665</id>
      <label>waterschap Limburg</label>
      <vindplaatsen>
         <heeftVindplaats>
            <Vindplaats>
               <url>https://identifier.overheid.nl/tooi/id/waterschap/ws0665</url>
            </Vindplaats>
         </heeftVindplaats>
      </vindplaatsen>
   </Waarde>
   <Waarde>
      <id>/tooi/id/waterschap/ws0653</id>
      <label>Wetterskip Frysl√¢n</label>
      <vindplaatsen>
         <heeftVindplaats>
            <Vindplaats>
               <url>https://identifier.overheid.nl/tooi/id/waterschap/ws0653</url>
            </Vindplaats>
         </heeftVindplaats>
      </vindplaatsen>
   </Waarde>
   <Waarde>
      <id>/tooi/id/waterschap/ws0650</id>
      <label>waterschap Zuiderzeeland</label>
      <vindplaatsen>
         <heeftVindplaats>
            <Vindplaats>
               <url>https://identifier.overheid.nl/tooi/id/waterschap/ws0650</url>
            </Vindplaats>
         </heeftVindplaats>
      </vindplaatsen>
   </Waarde>
</Waardelijst>
