<?xml version="1.0" encoding="UTF-8"?>
<Waardelijst schemaversie="1.3.0" xsi:schemaLocation="https://standaarden.overheid.nl/stop/imop/resources/ https://standaarden.overheid.nl/stop/1.3.0/imop-resources.xsd" xmlns="https://standaarden.overheid.nl/stop/imop/resources/" xmlns:rsc="https://standaarden.overheid.nl/stop/imop/resources/" xmlns:xsi="http://www.w3.org/2001/XMLSchema-instance">
  <WaardelijstInfo>
    <id>/tooi/def/class/Gemeente</id>
    <label>gemeente Gemeenten</label>
    <beschrijving>Alle extra gemeenten t.b.v. testen op ETO en ACC</beschrijving>
    <uitbreidbaar>0</uitbreidbaar>
    <versie>1.1.0</versie>
  </WaardelijstInfo>
  <Waarde>
    <id>/tooi/id/gemeente/gm9901</id>
    <label>gemeente TST_01</label>
    <beschrijving>Gemeente TST_01</beschrijving>
    <vindplaatsen>
      <heeftVindplaats>
        <Vindplaats>
          <url>https://identifier.overheid.nl/tooi/id/gemeente/gm9901</url>
        </Vindplaats>
      </heeftVindplaats>
    </vindplaatsen>
  </Waarde>
  <Waarde>
    <id>/tooi/id/gemeente/gm9902</id>
    <label>gemeente TST_02</label>
    <beschrijving>Gemeente TST_02</beschrijving>
    <vindplaatsen>
      <heeftVindplaats>
        <Vindplaats>
          <url>https://identifier.overheid.nl/tooi/id/gemeente/gm9902</url>
        </Vindplaats>
      </heeftVindplaats>
    </vindplaatsen>
  </Waarde>
  <Waarde>
    <id>/tooi/id/gemeente/gm9903</id>
    <label>gemeente TST_03</label>
    <beschrijving>Gemeente TST_03</beschrijving>
    <vindplaatsen>
      <heeftVindplaats>
        <Vindplaats>
          <url>https://identifier.overheid.nl/tooi/id/gemeente/gm9903</url>
        </Vindplaats>
      </heeftVindplaats>
    </vindplaatsen>
  </Waarde>
  <Waarde>
    <id>/tooi/id/gemeente/gm9904</id>
    <label>gemeente TST_04</label>
    <beschrijving>Gemeente TST_04</beschrijving>
    <vindplaatsen>
      <heeftVindplaats>
        <Vindplaats>
          <url>https://identifier.overheid.nl/tooi/id/gemeente/gm9904</url>
        </Vindplaats>
      </heeftVindplaats>
    </vindplaatsen>
  </Waarde>
  <Waarde>
    <id>/tooi/id/gemeente/gm9905</id>
    <label>gemeente TST_05</label>
    <beschrijving>Gemeente TST_05</beschrijving>
    <vindplaatsen>
      <heeftVindplaats>
        <Vindplaats>
          <url>https://identifier.overheid.nl/tooi/id/gemeente/gm9905</url>
        </Vindplaats>
      </heeftVindplaats>
    </vindplaatsen>
  </Waarde>
  <Waarde>
    <id>/tooi/id/gemeente/gm9906</id>
    <label>gemeente TST_06</label>
    <beschrijving>Gemeente TST_06</beschrijving>
    <vindplaatsen>
      <heeftVindplaats>
        <Vindplaats>
          <url>https://identifier.overheid.nl/tooi/id/gemeente/gm9906</url>
        </Vindplaats>
      </heeftVindplaats>
    </vindplaatsen>
  </Waarde>
  <Waarde>
    <id>/tooi/id/gemeente/gm9907</id>
    <label>gemeente TST_07</label>
    <beschrijving>Gemeente TST_07</beschrijving>
    <vindplaatsen>
      <heeftVindplaats>
        <Vindplaats>
          <url>https://identifier.overheid.nl/tooi/id/gemeente/gm9907</url>
        </Vindplaats>
      </heeftVindplaats>
    </vindplaatsen>
  </Waarde>
  <Waarde>
    <id>/tooi/id/gemeente/gm9908</id>
    <label>gemeente TST_08</label>
    <beschrijving>Gemeente TST_08</beschrijving>
    <vindplaatsen>
      <heeftVindplaats>
        <Vindplaats>
          <url>https://identifier.overheid.nl/tooi/id/gemeente/gm9908</url>
        </Vindplaats>
      </heeftVindplaats>
    </vindplaatsen>
  </Waarde>
  <Waarde>
    <id>/tooi/id/gemeente/gm9909</id>
    <label>gemeente TST_09</label>
    <beschrijving>Gemeente TST_09</beschrijving>
    <vindplaatsen>
      <heeftVindplaats>
        <Vindplaats>
          <url>https://identifier.overheid.nl/tooi/id/gemeente/gm9909</url>
        </Vindplaats>
      </heeftVindplaats>
    </vindplaatsen>
  </Waarde>
  <Waarde>
    <id>/tooi/id/gemeente/gm9910</id>
    <label>gemeente TST_10</label>
    <beschrijving>Gemeente TST_10</beschrijving>
    <vindplaatsen>
      <heeftVindplaats>
        <Vindplaats>
          <url>https://identifier.overheid.nl/tooi/id/gemeente/gm9910</url>
        </Vindplaats>
      </heeftVindplaats>
    </vindplaatsen>
  </Waarde>
  <Waarde>
    <id>/tooi/id/gemeente/gm9911</id>
    <label>gemeente TST_11</label>
    <beschrijving>Gemeente TST_11</beschrijving>
    <vindplaatsen>
      <heeftVindplaats>
        <Vindplaats>
          <url>https://identifier.overheid.nl/tooi/id/gemeente/gm9911</url>
        </Vindplaats>
      </heeftVindplaats>
    </vindplaatsen>
  </Waarde>
  <Waarde>
    <id>/tooi/id/gemeente/gm9912</id>
    <label>gemeente TST_12</label>
    <beschrijving>Gemeente TST_12</beschrijving>
    <vindplaatsen>
      <heeftVindplaats>
        <Vindplaats>
          <url>https://identifier.overheid.nl/tooi/id/gemeente/gm9912</url>
        </Vindplaats>
      </heeftVindplaats>
    </vindplaatsen>
  </Waarde>
  <Waarde>
    <id>/tooi/id/gemeente/gm9913</id>
    <label>gemeente TST_13</label>
    <beschrijving>Gemeente TST_13</beschrijving>
    <vindplaatsen>
      <heeftVindplaats>
        <Vindplaats>
          <url>https://identifier.overheid.nl/tooi/id/gemeente/gm9913</url>
        </Vindplaats>
      </heeftVindplaats>
    </vindplaatsen>
  </Waarde>
  <Waarde>
    <id>/tooi/id/gemeente/gm9914</id>
    <label>gemeente TST_14</label>
    <beschrijving>Gemeente TST_14</beschrijving>
    <vindplaatsen>
      <heeftVindplaats>
        <Vindplaats>
          <url>https://identifier.overheid.nl/tooi/id/gemeente/gm9914</url>
        </Vindplaats>
      </heeftVindplaats>
    </vindplaatsen>
  </Waarde>
  <Waarde>
    <id>/tooi/id/gemeente/gm9915</id>
    <label>gemeente TST_15</label>
    <beschrijving>Gemeente TST_15</beschrijving>
    <vindplaatsen>
      <heeftVindplaats>
        <Vindplaats>
          <url>https://identifier.overheid.nl/tooi/id/gemeente/gm9915</url>
        </Vindplaats>
      </heeftVindplaats>
    </vindplaatsen>
  </Waarde>
  <Waarde>
    <id>/tooi/id/gemeente/gm9916</id>
    <label>gemeente TST_16</label>
    <beschrijving>Gemeente TST_16</beschrijving>
    <vindplaatsen>
      <heeftVindplaats>
        <Vindplaats>
          <url>https://identifier.overheid.nl/tooi/id/gemeente/gm9916</url>
        </Vindplaats>
      </heeftVindplaats>
    </vindplaatsen>
  </Waarde>
  <Waarde>
    <id>/tooi/id/gemeente/gm9917</id>
    <label>gemeente TST_17</label>
    <beschrijving>Gemeente TST_17</beschrijving>
    <vindplaatsen>
      <heeftVindplaats>
        <Vindplaats>
          <url>https://identifier.overheid.nl/tooi/id/gemeente/gm9917</url>
        </Vindplaats>
      </heeftVindplaats>
    </vindplaatsen>
  </Waarde>
  <Waarde>
    <id>/tooi/id/gemeente/gm9918</id>
    <label>gemeente TST_18</label>
    <beschrijving>Gemeente TST_18</beschrijving>
    <vindplaatsen>
      <heeftVindplaats>
        <Vindplaats>
          <url>https://identifier.overheid.nl/tooi/id/gemeente/gm9918</url>
        </Vindplaats>
      </heeftVindplaats>
    </vindplaatsen>
  </Waarde>
  <Waarde>
    <id>/tooi/id/gemeente/gm9919</id>
    <label>gemeente TST_19</label>
    <beschrijving>Gemeente TST_19</beschrijving>
    <vindplaatsen>
      <heeftVindplaats>
        <Vindplaats>
          <url>https://identifier.overheid.nl/tooi/id/gemeente/gm9919</url>
        </Vindplaats>
      </heeftVindplaats>
    </vindplaatsen>
  </Waarde>
  <Waarde>
    <id>/tooi/id/gemeente/gm9920</id>
    <label>gemeente TST_20</label>
    <beschrijving>Gemeente TST_20</beschrijving>
    <vindplaatsen>
      <heeftVindplaats>
        <Vindplaats>
          <url>https://identifier.overheid.nl/tooi/id/gemeente/gm9920</url>
        </Vindplaats>
      </heeftVindplaats>
    </vindplaatsen>
  </Waarde>
  <Waarde>
    <id>/tooi/id/gemeente/gm9921</id>
    <label>gemeente TST_21</label>
    <beschrijving>Gemeente TST_21</beschrijving>
    <vindplaatsen>
      <heeftVindplaats>
        <Vindplaats>
          <url>https://identifier.overheid.nl/tooi/id/gemeente/gm9921</url>
        </Vindplaats>
      </heeftVindplaats>
    </vindplaatsen>
  </Waarde>
  <Waarde>
    <id>/tooi/id/gemeente/gm9922</id>
    <label>gemeente TST_22</label>
    <beschrijving>Gemeente TST_22</beschrijving>
    <vindplaatsen>
      <heeftVindplaats>
        <Vindplaats>
          <url>https://identifier.overheid.nl/tooi/id/gemeente/gm9922</url>
        </Vindplaats>
      </heeftVindplaats>
    </vindplaatsen>
  </Waarde>
  <Waarde>
    <id>/tooi/id/gemeente/gm9923</id>
    <label>gemeente TST_23</label>
    <beschrijving>Gemeente TST_23</beschrijving>
    <vindplaatsen>
      <heeftVindplaats>
        <Vindplaats>
          <url>https://identifier.overheid.nl/tooi/id/gemeente/gm9923</url>
        </Vindplaats>
      </heeftVindplaats>
    </vindplaatsen>
  </Waarde>
  <Waarde>
    <id>/tooi/id/gemeente/gm9924</id>
    <label>gemeente TST_24</label>
    <beschrijving>Gemeente TST_24</beschrijving>
    <vindplaatsen>
      <heeftVindplaats>
        <Vindplaats>
          <url>https://identifier.overheid.nl/tooi/id/gemeente/gm9924</url>
        </Vindplaats>
      </heeftVindplaats>
    </vindplaatsen>
  </Waarde>
  <Waarde>
    <id>/tooi/id/gemeente/gm9925</id>
    <label>gemeente TST_25</label>
    <beschrijving>Gemeente TST_25</beschrijving>
    <vindplaatsen>
      <heeftVindplaats>
        <Vindplaats>
          <url>https://identifier.overheid.nl/tooi/id/gemeente/gm9925</url>
        </Vindplaats>
      </heeftVindplaats>
    </vindplaatsen>
  </Waarde>
</Waardelijst>