<?xml version="1.0" encoding="utf-8"?>
<Waardelijst schemaversie="1.1.0"
  xmlns="https://standaarden.overheid.nl/stop/imop/resources/"
  xmlns:rsc="https://standaarden.overheid.nl/stop/imop/resources/"
  xmlns:xsi="http://www.w3.org/2001/XMLSchema-instance"
  xsi:schemaLocation="https://standaarden.overheid.nl/stop/imop/resources/
  https://standaarden.overheid.nl/stop/1.1.0/imop-resources.xsd">
  <WaardelijstInfo>
    <id>/join/id/stop/soortprocedure</id>
    <label>Besluitvormingsprocedures</label>
    <beschrijving>De waardelijst beschrijft onderkende besluitvormingsprocedures.</beschrijving>
    <uitbreidbaar>0</uitbreidbaar>
    <versie>1.1.0</versie>
  </WaardelijstInfo>
  <Waarde>
    <id>/join/id/stop/proceduretype_ontwerp</id>
    <label>Ontwerpbesluit</label>
  </Waarde>
  <Waarde>
    <id>/join/id/stop/proceduretype_definitief</id>
    <label>Definitief besluit</label>
  </Waarde>
</Waardelijst>
